{
  "agent": "Luca",
  "project": "Zetta AI",
  "ecosystem": "Base",
  "website": "https://www.zettaai.co",
  "x": "@zettaaidotco",
  "github": "@danbuildss",
  "did": "did:key:z6Mkszs82vnrmmctTyybGEMN7BDHg2awFEdpYYzfqXhGi1rf",
  "wallets": [
    {
      "address": "0xb98f0de777eea8c481b64e33d3e0066cea38fa91",
      "chain": "base",
      "role": "payment_receiver",
      "verification_method": "repo_manifest",
      "evidence_url": "https://github.com/danbuildss/agent-wallet-manifest",
      "notes": "Primary wallet. Receives all Zetta AI API revenue.",
      "last_updated": "2026-06-16",
      "active": true
    },
    {
      "address": "0xb2b335f832fd3f43461ebd1cd9831d93d9ca4ba3",
      "chain": "base",
      "role": "token_contract",
      "verification_method": "repo_manifest",
      "evidence_url": "https://basescan.org/address/0xb2b335f832fd3f43461ebd1cd9831d93d9ca4ba3",
      "notes": "$LUCA — the Zetta AI ecosystem token on Base.",
      "last_updated": "2026-06-16",
      "active": true
    }
  ]
}
